{"capability_version":"1.0.0","composition_digest":"e4e3a0b8c53aa263f092fe1b3e524774a0bea7c45d1d6df1300548304252e24c","dsl_version":"codestrata.io/rules/v1","overlay_digest":"8e57b4ff8785b7cd27af94a18c72ae6301458cabeb73f3806395d8bb8e210227","resolver_version":"1.0.0","rules":[{"presentation":{"bindings":[{"evidence":"dependency_path","name":"dependency_path","type":"string"}],"documentation_url":"https://docs.codestrata.ai/rules/architecture/dependency-cycle","message_template":"{{dependency_path}} participates in an import cycle","remediation_template":null},"resolved":{"adoption":"recommended","default_enabled":true,"default_severity":"high","effective_severity":"high","enabled":true,"exception_refs":[],"override_source":null,"parameters":{},"policy_refs":[],"revision":"1.0.0","rule_digest":"b97b6d9fd8a443164020dc972219c3dc5a109cba22e50e71f56803e24a7a696c","rule_id":"architecture.dependency-cycle","selector_digest":"6c592538df233e39ddb5d9fff2a3bf191eeabe58600fcd7b5475cfdb7c546048"},"scoped_exceptions":[]}],"ruleset_id":"codestrata.engineering-standard","ruleset_version":"1.0.0","schema_name":"codestrata.overridden-ruleset.v1","schema_version":"1.0.0"}
